{
  "schemaVersion": 1,
  "batchId": "batch-003",
  "createdAt": "2026-10-26T13:04:20+08:00",
  "scope": {
    "year": 2026,
    "venues": [
      "ACL",
      "ICLR",
      "ICML",
      "NeurIPS"
    ],
    "description": "Stage 01第三批：补充记忆行动、开放工具、动态环境、过程诊断、安全和执行效率。来源核实→相关性→增量覆盖→摘要核对；不是质量排名。",
    "limitations": [
      "仅元数据与正式Abstract；尚未核读方法和关键实验。",
      "实际重读14篇候选摘要，选入10篇、延后4篇；DSP曾在第二批延后，本批重新查看，不重复入库。",
      "ICML BPOP的具体轨道未知；其余9篇来源为ACL/ICLR主会论文集。不把Poster页面当作轨道证明。",
      "本批无新增NeurIPS论文；不强制会议或问题等额。覆盖为目的性样本，不能推断领域热点。",
      "未提供新的个人阅读笔记，不推断用户兴趣、不更改阅读状态。"
    ]
  },
  "questionCatalog": [
    {
      "id": "Q01",
      "name": "规划与长程执行",
      "question": "Agent如何拆解长任务，并在环境变化后调整计划？"
    },
    {
      "id": "Q02",
      "name": "工具使用",
      "question": "Agent如何选择工具、生成有效参数并处理工具调用失败？"
    },
    {
      "id": "Q03",
      "name": "记忆与状态",
      "question": "Agent如何保存、检索和更新信息，避免使用无关或过时记忆？"
    },
    {
      "id": "Q04",
      "name": "Agent训练与RL",
      "question": "如何从交互轨迹和延迟奖励中学习有效行动？"
    },
    {
      "id": "Q05",
      "name": "反思与恢复",
      "question": "Agent如何发现错误，并利用反馈改善后续行动？"
    },
    {
      "id": "Q06",
      "name": "多智能体协作",
      "question": "什么条件下协作有效，如何控制通信与协调成本？"
    },
    {
      "id": "Q07",
      "name": "评测与可靠性",
      "question": "如何判断Agent真正完成任务，并测量结果的稳定性？"
    },
    {
      "id": "Q08",
      "name": "效率与安全",
      "question": "如何控制执行成本、合理停止，并减少不安全行动？"
    }
  ],
  "records": [
    {
      "paper": {
        "id": "acl-2026.acl-long.583",
        "title": "Memory-R1: Enhancing Large Language Model Agents to Manage and Utilize Memories via Reinforcement Learning",
        "authors": [
          {
            "name": "Sikuan Yan"
          },
          {
            "name": "Xiufeng Yang"
          },
          {
            "name": "Zuchao Huang"
          },
          {
            "name": "Ercong Nie"
          },
          {
            "name": "Zifeng Ding"
          },
          {
            "name": "Zonggen Li"
          },
          {
            "name": "Xiaowen Ma"
          },
          {
            "name": "Jinhe Bi"
          },
          {
            "name": "Kristian Kersting"
          },
          {
            "name": "Jeff Z. Pan"
          },
          {
            "name": "Hinrich Schütze"
          },
          {
            "name": "Volker Tresp"
          },
          {
            "name": "Yunpu Ma"
          }
        ],
        "venue": "ACL",
        "year": 2026,
        "direction": "Agent",
        "subdirection": "Q03｜学习记忆管理操作",
        "researchQuestion": "如何用任务结果训练Agent，使它主动管理外部记忆并利用相关内容回答问题？",
        "links": {
          "official": "https://aclanthology.org/2026.acl-long.583/",
          "pdf": "https://aclanthology.org/2026.acl-long.583.pdf"
        }
      },
      "review": {
        "decision": "candidate",
        "suggestedDecision": "included",
        "mainQuestionId": "Q03",
        "scenarios": [
          "长期对话记忆与问答"
        ],
        "reason": "相较Sculptor主动整理上下文和经验记忆质量分析，本篇补充通过任务结果学习外部记忆操作的路线。",
        "openQuestions": [
          "需核读训练样本、奖励、基线与数据划分；摘要的问答收益不能直接外推到行动任务。",
          "仅摘要级初筛；尚未核读方法与关键实验，不是已核实优质精选。"
        ]
      },
      "verification": {
        "sourceLevel": "abstract",
        "track": "main",
        "trackVerified": true,
        "humanConfirmed": false,
        "readSections": [
          "官方单篇页：题名、作者、正式Abstract与来源链接；未使用Lay Summary替代Abstract"
        ],
        "trackLabel": "ACL 2026 Main Long Papers"
      },
      "evidence": [
        {
          "id": "B003-acl-2026.acl-long.583-META",
          "url": "https://aclanthology.org/2026.acl-long.583/",
          "retrievedAt": "2026-10-26T12:59:27+08:00",
          "locator": "题名、作者栏、会议年份与公开链接",
          "supports": [
            "paper.id",
            "paper.title",
            "paper.authors",
            "paper.venue",
            "paper.year",
            "paper.links",
            "verification.track",
            "verification.trackVerified"
          ],
          "claimType": "fact"
        },
        {
          "id": "B003-acl-2026.acl-long.583-ABS",
          "url": "https://aclanthology.org/2026.acl-long.583/",
          "retrievedAt": "2026-10-26T12:59:27+08:00",
          "locator": "Abstract",
          "supports": [
            "aiSummary.problem",
            "aiSummary.finding",
            "aiSummary.approach",
            "guides"
          ],
          "claimType": "author_claim"
        },
        {
          "id": "B003-acl-2026.acl-long.583-CLASSIFY",
          "url": "https://aclanthology.org/2026.acl-long.583/",
          "retrievedAt": "2026-10-26T12:59:27+08:00",
          "locator": "基于Abstract和已有阅读池的暂定分类与增量选取理由",
          "supports": [
            "review",
            "paper.researchQuestion",
            "paper.subdirection"
          ],
          "claimType": "judgment"
        }
      ],
      "aiSummary": {
        "problem": "外部记忆库能补充有限上下文，但静态规则未必知道该保存、更新或删除什么，也未必能把检索结果有效用于推理。",
        "finding": "论文报告：Memory-R1在LoCoMo、MSC和LongMemEval等记忆测试中优于所比较基线，并展示跨问题类型与模型规模的适用性；这不等于已验证真实工具执行效果。",
        "approach": "设置记忆管理与回答两个角色：前者学习新增、更新、删除或不操作，后者筛选相关条目并推理；使用结果驱动的强化学习训练两者。",
        "basis": {
          "problem": [
            "B003-acl-2026.acl-long.583-ABS"
          ],
          "finding": [
            "B003-acl-2026.acl-long.583-ABS"
          ],
          "approach": [
            "B003-acl-2026.acl-long.583-ABS"
          ]
        },
        "generatedAt": "2026-10-26T13:04:20+08:00",
        "generator": "Codex; exact model version not recorded",
        "humanChecked": false
      }
    },
    {
      "paper": {
        "id": "acl-2026.acl-long.370",
        "title": "Mem2ActBench: A Benchmark for Evaluating Long-Term Memory Utilization in Task-Oriented Autonomous Agents",
        "authors": [
          {
            "name": "Yiting Shen"
          },
          {
            "name": "Kun Li"
          },
          {
            "name": "Wei Zhou"
          },
          {
            "name": "Songlin Hu"
          }
        ],
        "venue": "ACL",
        "year": 2026,
        "direction": "Agent",
        "subdirection": "Q03｜从记住信息到正确行动",
        "researchQuestion": "Agent能否主动利用长期交互中的偏好与任务状态，选择工具并填写正确参数？",
        "links": {
          "official": "https://aclanthology.org/2026.acl-long.370/",
          "pdf": "https://aclanthology.org/2026.acl-long.370.pdf",
          "code": "https://github.com/Cantaloupe-M/Mem2ActBench"
        }
      },
      "review": {
        "decision": "candidate",
        "suggestedDecision": "included",
        "mainQuestionId": "Q03",
        "scenarios": [
          "长期个人助理与工具调用"
        ],
        "reason": "补充Q03的行动型评测边界，与Memory-R1的记忆问答训练对照：记住或答对不自动代表会行动。",
        "openQuestions": [
          "需核读任务生成、记忆依赖性的人工检查和判分方式，判断是否能区分检索失败与使用失败。",
          "仅摘要级初筛；尚未核读方法与关键实验，不是已核实优质精选。"
        ]
      },
      "verification": {
        "sourceLevel": "abstract",
        "track": "main",
        "trackVerified": true,
        "humanConfirmed": false,
        "readSections": [
          "官方单篇页：题名、作者、正式Abstract与来源链接；未使用Lay Summary替代Abstract"
        ],
        "trackLabel": "ACL 2026 Main Long Papers"
      },
      "evidence": [
        {
          "id": "B003-acl-2026.acl-long.370-META",
          "url": "https://aclanthology.org/2026.acl-long.370/",
          "retrievedAt": "2026-10-26T12:59:28+08:00",
          "locator": "题名、作者栏、会议年份与公开链接",
          "supports": [
            "paper.id",
            "paper.title",
            "paper.authors",
            "paper.venue",
            "paper.year",
            "paper.links",
            "verification.track",
            "verification.trackVerified"
          ],
          "claimType": "fact"
        },
        {
          "id": "B003-acl-2026.acl-long.370-ABS",
          "url": "https://aclanthology.org/2026.acl-long.370/",
          "retrievedAt": "2026-10-26T12:59:28+08:00",
          "locator": "Abstract",
          "supports": [
            "aiSummary.problem",
            "aiSummary.finding",
            "aiSummary.approach",
            "guides"
          ],
          "claimType": "author_claim"
        },
        {
          "id": "B003-acl-2026.acl-long.370-CLASSIFY",
          "url": "https://aclanthology.org/2026.acl-long.370/",
          "retrievedAt": "2026-10-26T12:59:28+08:00",
          "locator": "基于Abstract和已有阅读池的暂定分类与增量选取理由",
          "supports": [
            "review",
            "paper.researchQuestion",
            "paper.subdirection"
          ],
          "claimType": "judgment"
        }
      ],
      "aiSummary": {
        "problem": "现有记忆测试常要求回答明确提出的事实问题，难以判断Agent是否会在没有显式提醒时，把旧偏好和任务状态用于工具执行。",
        "finding": "论文报告：在其工具使用测试中，所测记忆框架仍难以主动利用记忆确定调用参数；结论限定于该基准及所比较系统。",
        "approach": "合并工具与对话来源，进行一致性处理，构造长期交互记忆链，再反向生成依赖这些记忆的工具任务，检查工具选择与参数依据。",
        "basis": {
          "problem": [
            "B003-acl-2026.acl-long.370-ABS"
          ],
          "finding": [
            "B003-acl-2026.acl-long.370-ABS"
          ],
          "approach": [
            "B003-acl-2026.acl-long.370-ABS"
          ]
        },
        "generatedAt": "2026-10-26T13:04:20+08:00",
        "generator": "Codex; exact model version not recorded",
        "humanChecked": false
      }
    },
    {
      "paper": {
        "id": "acl-2026.acl-long.584",
        "title": "CostBench: Evaluating Multi-Turn Cost-Optimal Planning and Adaptation in Dynamic Environments for LLM Tool-Use Agents",
        "authors": [
          {
            "name": "Jiayu Liu"
          },
          {
            "name": "Cheng Qian"
          },
          {
            "name": "Zhaochen Su"
          },
          {
            "name": "Qing Zong"
          },
          {
            "name": "Shijue Huang"
          },
          {
            "name": "Bingxiang He"
          },
          {
            "name": "Yi R. Fung"
          }
        ],
        "venue": "ACL",
        "year": 2026,
        "direction": "Agent",